0,Surreal landscapes crumbling into nothingness trending on artstation,init_images/28_210-192-70-192-120-250.png
28,dissolving structures into nothingness trending on artstation
238,Futuristic cities disintegrating into dust trending on artstation
430,Transcendence into the unknown trending on artstation
500,Spiritual dissolution into the cosmic void trending on artstation
692,Metamorphosis into emptiness, trending on artstation
812,Geometric patterns fading into the void trending on artstation
1062,Phantasmagoria of disappearing forms trending on artstation
